{
  "schema_version": "1.0.0",
  "evidence_id": "SIM-001:example-payload:v1",
  "scenario_id": "SIM-001",
  "result_artifact": {
    "path": "results/SIM-001-qa-design.md",
    "sha256": "cdf2ddd4aa30b811a1361b988fa606085b3aef61334580e27918787b86d0408c"
  },
  "routing_trace": {
    "schema_version": "1.0.0",
    "simulation_id": "SIM-001",
    "status": "PASS",
    "command": "commands/qa-design.md",
    "constitution": "constitution/qa-agent-constitution.md",
    "policies": [
      "policies/no-product-specific-leakage.md",
      "policies/evidence-and-citation-policy.md",
      "policies/human-gate-policy.md"
    ],
    "workflow": "workflows/requirement-to-test-plan.md",
    "primary_agent": "agents/test-designer.md",
    "supporting_agents": [],
    "skills": [
      "skills/qa-test-design/SKILL.md"
    ],
    "audit_before_edit": "Not required; this is read-only analysis with no implementation handoff.",
    "human_gate": {
      "required": false,
      "level": 0
    },
    "stop_condition": "Stop if undocumented behavior would be presented as confirmed or any file modification is attempted.",
    "expected_artifact": "Read-only test-design summary, scenario matrix, risks, test levels, assumptions, and open questions."
  },
  "provenance": {
    "consumer_revision": "777f7d5cc5017260df04c012eae963ef3ad63379",
    "hub_pin": "81197bf84ed51913bc3a93ace41661ab80a8e3b9",
    "schema_versions": {
      "payload": "1.0.0",
      "routing_trace": "1.0.0"
    }
  }
}
